{
  "$schema": "ucmis_mapping_configuration.schema.json",
  "_comment": "Questions: attribute and association definitions from source model? Multiplicity of subject class from source model? Other placed indicated with??",
  "transformation": {
    "description": "DDI-CDI to CDIF Profile Data Description",
    "version": "1",
    "sourceModel": {
      "name": "DDI-CDI",
      "mainPackage": "DDICDILibrary",
      "uri": "http://ddialliance.org/Specification/DDI-CDI/1.0/XMI/"
    },
    "targetModel": {
      "acronym": "CDIF",
      "modelTitle": "UML Model for the Cross-Domain Interoperability Framework (CDIF)",
      "subTitle": "A Standards‑Based Framework for Cross‑Domain Data Exchange and Reuse",
      "majorVersion": "1",
      "minorVersion": "0",
      "language": "en",
      "uri": "http://w3id.org/cdif/ddsc/1.0/ddsc/xmi/",
      "definition": "Many important research questions demand a multi-disciplinary approach in which data and resources are used across domain and infrastructure boundaries. In such scenarios, domain-specific community standards fall short of the requirements for FAIR exchange of the critical metadata and other information needed. The Cross-Domain Interoperability Framework (CDIF) is designed to support FAIR implementation for these projects by establishing a ‘lingua franca’ for this information, based on existing standards and technology to support interoperability, in both human- and machine-actionable fashion. CDIF is a set of implementation recommendations, based on profiles of common, domain-neutral metadata standards which are aligned to work together to support core functions required by FAIR.",
      "mainPackage": "DDSC",
      "mainPackageDefinition": "Profile for Data Description",
      "dataTypesPackage": "DDSC"
    }
  },
  "package": [
    {
      "name": "Classes",
      "parent": "DDSC",
      "definition": "This package contains the definitions of the classes in the DDSC profile with all their relationships and attributes."
    }
  ],
  "mapping": {
    "class": [
      {
        "mappingType": "map",
        "sourceClass": "DataStore",
        "targetPackage": "Classes",
        "targetClass": "DataStore",
        "attribute": [
          {
            "name": "name",
            "multiplicity": {
              "lower": "1",
              "upper": "1"
            }
          }
        ],
        "sssom": [
          {
            "subject_label":"DDI-CDI DataStore",
            "object_label":"CDIF DDSC DataStore",
            "predicate_id": "skos:narrorMatch",
            "predicate_label": "Object class has less attributes.",
            "confidence": 1.0,
            "comment": "Object class has less attributes."
            
          }
        ]
      },
      {
        "mappingType": "map",
        "sourceClass": "LogicalRecord",
        "targetPackage": "Classes",
        "targetClass": "LogicalRecord"
      },
      {
        "mappingType": "merge",
        "sourceClass": [
          "WideDataSet",
          "PhysicalDataSet"
        ],
        "targetPackage": "Classes",
        "targetClass": "WideDataSet",
        "definitionFrom": "WideDataSet",
        "attribute": [
          {
            "name": "name",
            "fromSourceClass": "PhysicalDataSet",
            "multiplicity": {
              "lower": "1",
              "upper": "1"
            }
          },
          {
            "name": "physicalFileName",
            "fromSourceClass": "PhysicalDataSet",
            "multiplicity": {
              "lower": "1",
              "upper": "1"
            }
          }
        ],
        "sssom": [
          {
            "subject_label":"Merge of DDI-CDI WideDataSet and PhysicalDataSet",
            "object_label":"CDIF DDSC WideDataSet",
            "predicate_id": "skos:relatedMatch",
            "predicate_label": "Object class takes definition from WideDataSet and some attributes from PhysicalDataSet.",
            "confidence": 1.0,
            "comment": "Object class takes definition from WideDataSet and some attributes from PhysicalDataSet."
            
          }
        ]
      },
      {
        "mappingType": "merge",
        "sourceClass": [
          "LongDataSet",
          "PhysicalDataSet"
        ],
        "targetPackage": "Classes",
        "targetClass": "LongDataSet",
        "definitionFrom": "LongDataSet",
        "attribute": [
          {
            "name": "name",
            "fromSourceClass": "PhysicalDataSet",
            "multiplicity": {
              "lower": "1",
              "upper": "1"
            }
          },
          {
            "name": "physicalFileName",
            "fromSourceClass": "PhysicalDataSet",
            "multiplicity": {
              "lower": "1",
              "upper": "1"
            }
          }
        ]
      },
      {
        "mappingType": "merge",
        "sourceClass": [
          "DimensionalDataSet",
          "PhysicalDataSet"
        ],
        "targetPackage": "Classes",
        "targetClass": "DimensionalDataSet",
        "definitionFrom": "DimensionalDataSet",
        "attribute": [
          {
            "name": "name",
            "fromSourceClass": "PhysicalDataSet",
            "multiplicity": {
              "lower": "1",
              "upper": "1"
            }
          },
          {
            "name": "physicalFileName",
            "fromSourceClass": "PhysicalDataSet",
            "multiplicity": {
              "lower": "1",
              "upper": "1"
            }
          }
        ]
      },
      {
        "mappingType": "map",
        "sourceClass": "WideDataStructure",
        "targetPackage": "Classes",
        "targetClass": "WideDataStructure"
      },
      {
        "mappingType": "map",
        "sourceClass": "LongDataStructure",
        "targetPackage": "Classes",
        "targetClass": "LongDataStructure"
      },
      {
        "mappingType": "map",
        "sourceClass": "DimensionalDataStructure",
        "targetPackage": "Classes",
        "targetClass": "DimensionalDataStructure"
      },
      {
        "mappingType": "map",
        "sourceClass": "InstanceVariable",
        "targetPackage": "Classes",
        "targetClass": "InstanceVariable",
        "attribute": [
          {
            "name": "name",
            "multiplicity": {
              "lower": "1",
              "upper": "1"
            }
          },
          {
            "name": "definition",
            "multiplicity": {
              "lower": "1",
              "upper": "1"
            }
          },
          {
            "name": "describedUnitOfMeasure",
            "multiplicity": {
              "lower": "0",
              "upper": "1"
            }
          },
          {
            "name": "unitOfMeasureKind",
            "multiplicity": {
              "lower": "0",
              "upper": "1"
            }
          }
        ]
      },
      {
        "mappingType": "map",
        "sourceClass": "RepresentedVariable",
        "targetPackage": "Classes",
        "targetClass": "RepresentedVariable",
        "attribute": [
          {
            "name": "name",
            "multiplicity": {
              "lower": "1",
              "upper": "1"
            }
          },
          {
            "name": "definition",
            "multiplicity": {
              "lower": "1",
              "upper": "1"
            }
          },
          {
            "name": "describedUnitOfMeasure",
            "multiplicity": {
              "lower": "0",
              "upper": "1"
            }
          },
          {
            "name": "unitOfMeasureKind",
            "multiplicity": {
              "lower": "0",
              "upper": "1"
            }
          }
        ]
      },
      {
        "mappingType": "map",
        "sourceClass": "ReferenceVariable",
        "targetPackage": "Classes",
        "targetClass": "ReferenceVariable",
        "attribute": [
          {
            "name": "name",
            "multiplicity": {
              "lower": "1",
              "upper": "1"
            }
          }
        ]
      },
      {
        "mappingType": "map",
        "sourceClass": "DescriptorVariable",
        "targetPackage": "Classes",
        "targetClass": "DescriptorVariable",
        "attribute": [
          {
            "name": "name",
            "multiplicity": {
              "lower": "1",
              "upper": "1"
            }
          }
        ]
      },
      {
        "mappingType": "map",
        "sourceClass": "SubstantiveValueDomain",
        "targetPackage": "Classes",
        "targetClass": "SubstantiveValueDomain",
        "attribute": [
          {
            "name": "recommendedDataType",
            "multiplicity": {
              "lower": "1",
              "upper": "1"
            }
          }
        ]
      },
      {
        "mappingType": "map",
        "sourceClass": "SentinelValueDomain",
        "targetPackage": "Classes",
        "targetClass": "SentinelValueDomain",
        "attribute": [
          {
            "name": "recommendedDataType",
            "multiplicity": {
              "lower": "1",
              "upper": "1"
            }
          }
        ]
      },
      {
        "mappingType": "map",
        "sourceClass": "DescriptorValueDomain",
        "targetPackage": "Classes",
        "targetClass": "DescriptorValueDomain"
      },
      {
        "mappingType": "map",
        "sourceClass": "Descriptor",
        "targetPackage": "Classes",
        "targetClass": "Descriptor",
        "attribute": [
          {
            "name": "content",
            "multiplicity": {